{
  "id": "ph-even-if-even",
  "module": "phrases",
  "frame_en": "even if / even",
  "frame_zh": "哪怕…",
  "usage": "最小让步",
  "group": "递进加强类",
  "group_id": "group-6",
  "examples": [
    {
      "en": "not just\"We must see not just the illness, but every individual person.\"",
      "zh": "我们不仅要看到病人的病，更要看到每一个具体的人。",
      "source": "drama:english-phrases:group-6",
      "ctx": "🎬 问心2 第15集 · 宣传稿里写移植团队的理念——\"not just A, but B\"把重点压在后半句，是递进里的经典句式。"
    },
    {
      "en": "let alone\"Even a third-rate author wouldn't take them, let alone He Han.\"",
      "zh": "三流作者都不一定愿意，更别说他是何韩了。",
      "source": "drama:english-phrases:group-6",
      "ctx": "🎬 爱情没有神话 第23集 · 对方嫌展翘替何韩谈的条件太苛刻——\"连低标准都达不到，更别说高标准\"，let alone 用来递进到极端。"
    }
  ],
  "tags": [
    "group-6"
  ]
}
